{
  "$schema": "https://json-schema.org/draft/2020-12/schema",
  "$id": "urn:ais:0.0.2:plan",
  "title": "AIS Execution Plan (ais-plan/0.0.3)",
  "$ref": "#/$defs/Root_1",
  "$defs": {
    "extensions_7": {
      "type": "object",
      "additionalProperties": {}
    },
    "meta_3": {
      "type": "object",
      "properties": {
        "created_at": {
          "type": "string"
        },
        "name": {
          "type": "string"
        },
        "description": {
          "type": "string"
        },
        "extensions": {
          "$ref": "#/$defs/extensions_7"
        }
      },
      "additionalProperties": false
    },
    "Union18_0_18": {
      "type": "object",
      "properties": {
        "lit": {}
      },
      "required": [
        "lit"
      ],
      "additionalProperties": false
    },
    "Union20_1_20": {
      "type": "object",
      "properties": {
        "ref": {
          "type": "string"
        }
      },
      "required": [
        "ref"
      ],
      "additionalProperties": false
    },
    "Union22_2_22": {
      "type": "object",
      "properties": {
        "cel": {
          "type": "string"
        }
      },
      "required": [
        "cel"
      ],
      "additionalProperties": false
    },
    "object_35": {
      "type": "object",
      "additionalProperties": {
        "$ref": "#/$defs/condition_17"
      }
    },
    "Union34_4_34": {
      "type": "object",
      "properties": {
        "object": {
          "$ref": "#/$defs/object_35"
        }
      },
      "required": [
        "object"
      ],
      "additionalProperties": false
    },
    "Union36_5_36": {
      "type": "object",
      "properties": {
        "array": {
          "type": "array",
          "items": {
            "$ref": "#/$defs/condition_17"
          }
        }
      },
      "required": [
        "array"
      ],
      "additionalProperties": false
    },
    "condition_17": {
      "anyOf": [
        {
          "$ref": "#/$defs/Union18_0_18"
        },
        {
          "$ref": "#/$defs/Union20_1_20"
        },
        {
          "$ref": "#/$defs/Union22_2_22"
        },
        {
          "$ref": "#/$defs/Union34_4_34"
        },
        {
          "$ref": "#/$defs/Union36_5_36"
        }
      ]
    },
    "retry_39": {
      "type": "object",
      "properties": {
        "interval_ms": {
          "type": "integer",
          "exclusiveMinimum": 0
        },
        "max_attempts": {
          "type": "integer",
          "exclusiveMinimum": 0
        },
        "backoff": {
          "type": "string",
          "enum": [
            "fixed"
          ]
        },
        "extensions": {
          "$ref": "#/$defs/extensions_7"
        }
      },
      "required": [
        "interval_ms"
      ],
      "additionalProperties": false
    },
    "params_45": {
      "type": "object",
      "additionalProperties": {
        "$ref": "#/$defs/condition_17"
      }
    },
    "bindings_44": {
      "type": "object",
      "properties": {
        "params": {
          "$ref": "#/$defs/params_45"
        },
        "extensions": {
          "$ref": "#/$defs/extensions_7"
        }
      },
      "additionalProperties": false
    },
    "Lazy_53": {
      "type": "object",
      "properties": {
        "name": {
          "type": "string"
        },
        "type": {
          "type": "string"
        },
        "components": {
          "type": "array",
          "items": {
            "$ref": "#/$defs/Lazy_53"
          }
        }
      },
      "required": [
        "name",
        "type"
      ],
      "additionalProperties": false
    },
    "abi_49": {
      "type": "object",
      "properties": {
        "type": {
          "const": "function"
        },
        "name": {
          "type": "string"
        },
        "inputs": {
          "type": "array",
          "items": {
            "$ref": "#/$defs/Lazy_53"
          }
        },
        "outputs": {
          "type": "array",
          "items": {
            "$ref": "#/$defs/Lazy_53"
          }
        }
      },
      "required": [
        "type",
        "name",
        "inputs"
      ],
      "additionalProperties": false
    },
    "args_58": {
      "type": "object",
      "additionalProperties": {
        "$ref": "#/$defs/condition_17"
      }
    },
    "Union47_0_47": {
      "type": "object",
      "properties": {
        "type": {
          "const": "evm_read"
        },
        "to": {
          "$ref": "#/$defs/condition_17"
        },
        "abi": {
          "$ref": "#/$defs/abi_49"
        },
        "args": {
          "$ref": "#/$defs/args_58"
        },
        "extensions": {
          "$ref": "#/$defs/extensions_7"
        }
      },
      "required": [
        "type",
        "to",
        "abi",
        "args"
      ],
      "additionalProperties": false
    },
    "args_65": {
      "type": "object",
      "additionalProperties": {
        "$ref": "#/$defs/condition_17"
      }
    },
    "Def_63": {
      "type": "object",
      "properties": {
        "id": {
          "type": "string"
        },
        "to": {
          "$ref": "#/$defs/condition_17"
        },
        "abi": {
          "$ref": "#/$defs/abi_49"
        },
        "args": {
          "$ref": "#/$defs/args_65"
        },
        "extensions": {
          "$ref": "#/$defs/extensions_7"
        }
      },
      "required": [
        "id",
        "to",
        "abi",
        "args"
      ],
      "additionalProperties": false
    },
    "Union59_1_59": {
      "type": "object",
      "properties": {
        "type": {
          "const": "evm_multiread"
        },
        "method": {
          "type": "string",
          "enum": [
            "multicall3",
            "rpc_batch"
          ]
        },
        "calls": {
          "type": "array",
          "items": {
            "$ref": "#/$defs/Def_63"
          }
        },
        "extensions": {
          "$ref": "#/$defs/extensions_7"
        }
      },
      "required": [
        "type",
        "method",
        "calls"
      ],
      "additionalProperties": false
    },
    "args_68": {
      "type": "object",
      "additionalProperties": {
        "$ref": "#/$defs/condition_17"
      }
    },
    "Union66_2_66": {
      "type": "object",
      "properties": {
        "type": {
          "const": "evm_call"
        },
        "to": {
          "$ref": "#/$defs/condition_17"
        },
        "abi": {
          "$ref": "#/$defs/abi_49"
        },
        "args": {
          "$ref": "#/$defs/args_68"
        },
        "value": {
          "$ref": "#/$defs/condition_17"
        },
        "extensions": {
          "$ref": "#/$defs/extensions_7"
        }
      },
      "required": [
        "type",
        "to",
        "abi",
        "args"
      ],
      "additionalProperties": false
    },
    "args_73": {
      "type": "object",
      "additionalProperties": {
        "$ref": "#/$defs/condition_17"
      }
    },
    "Def_72": {
      "type": "object",
      "properties": {
        "abi": {
          "$ref": "#/$defs/abi_49"
        },
        "args": {
          "$ref": "#/$defs/args_73"
        },
        "condition": {
          "$ref": "#/$defs/condition_17"
        },
        "extensions": {
          "$ref": "#/$defs/extensions_7"
        }
      },
      "required": [
        "abi",
        "args"
      ],
      "additionalProperties": false
    },
    "Union69_3_69": {
      "type": "object",
      "properties": {
        "type": {
          "const": "evm_multicall"
        },
        "to": {
          "$ref": "#/$defs/condition_17"
        },
        "calls": {
          "type": "array",
          "items": {
            "$ref": "#/$defs/Def_72"
          }
        },
        "deadline": {
          "$ref": "#/$defs/condition_17"
        },
        "extensions": {
          "$ref": "#/$defs/extensions_7"
        }
      },
      "required": [
        "type",
        "to",
        "calls"
      ],
      "additionalProperties": false
    },
    "Lazy_77": {
      "type": "object",
      "properties": {
        "id": {
          "type": "string",
          "pattern": "^[a-zA-Z0-9_-]+$"
        },
        "description": {
          "type": "string"
        },
        "condition": {
          "$ref": "#/$defs/condition_17"
        },
        "chain": {
          "type": "string",
          "pattern": "^(eip155|solana|cosmos|bip122|aptos|sui):[a-zA-Z0-9._-]+$"
        },
        "execution": {
          "$ref": "#/$defs/execution_46"
        },
        "extensions": {
          "$ref": "#/$defs/extensions_7"
        }
      },
      "required": [
        "id",
        "execution"
      ],
      "additionalProperties": false
    },
    "Union74_4_74": {
      "type": "object",
      "properties": {
        "type": {
          "const": "composite"
        },
        "steps": {
          "type": "array",
          "items": {
            "$ref": "#/$defs/Lazy_77"
          },
          "minItems": 1
        },
        "extensions": {
          "$ref": "#/$defs/extensions_7"
        }
      },
      "required": [
        "type",
        "steps"
      ],
      "additionalProperties": false
    },
    "Def_85": {
      "type": "object",
      "properties": {
        "name": {
          "type": "string"
        },
        "pubkey": {
          "$ref": "#/$defs/condition_17"
        },
        "signer": {
          "$ref": "#/$defs/condition_17"
        },
        "writable": {
          "$ref": "#/$defs/condition_17"
        },
        "extensions": {
          "$ref": "#/$defs/extensions_7"
        }
      },
      "required": [
        "name",
        "pubkey",
        "signer",
        "writable"
      ],
      "additionalProperties": false
    },
    "Union81_5_81": {
      "type": "object",
      "properties": {
        "type": {
          "const": "solana_instruction"
        },
        "program": {
          "$ref": "#/$defs/condition_17"
        },
        "instruction": {
          "type": "string"
        },
        "discriminator": {
          "$ref": "#/$defs/condition_17"
        },
        "accounts": {
          "type": "array",
          "items": {
            "$ref": "#/$defs/Def_85"
          }
        },
        "data": {
          "$ref": "#/$defs/condition_17"
        },
        "compute_units": {
          "$ref": "#/$defs/condition_17"
        },
        "lookup_tables": {
          "$ref": "#/$defs/condition_17"
        },
        "extensions": {
          "$ref": "#/$defs/extensions_7"
        }
      },
      "required": [
        "type",
        "program",
        "instruction",
        "accounts",
        "data"
      ],
      "additionalProperties": false
    },
    "Union87_6_87": {
      "type": "object",
      "properties": {
        "type": {
          "const": "solana_read"
        },
        "method": {
          "type": "string",
          "minLength": 1
        },
        "params": {
          "$ref": "#/$defs/condition_17"
        },
        "extensions": {
          "$ref": "#/$defs/extensions_7"
        }
      },
      "required": [
        "type",
        "method"
      ],
      "additionalProperties": false
    },
    "mapping_93": {
      "type": "object",
      "additionalProperties": {
        "$ref": "#/$defs/condition_17"
      }
    },
    "Union90_7_90": {
      "type": "object",
      "properties": {
        "type": {
          "const": "bitcoin_psbt"
        },
        "script_type": {
          "type": "string",
          "enum": [
            "p2wpkh",
            "p2tr",
            "p2sh",
            "p2wsh"
          ]
        },
        "mapping": {
          "$ref": "#/$defs/mapping_93"
        },
        "extensions": {
          "$ref": "#/$defs/extensions_7"
        }
      },
      "required": [
        "type",
        "script_type",
        "mapping"
      ],
      "additionalProperties": false
    },
    "Union94_8_94": {
      "type": "object",
      "properties": {
        "type": {
          "type": "string",
          "minLength": 1
        }
      },
      "required": [
        "type"
      ],
      "additionalProperties": true
    },
    "execution_46": {
      "anyOf": [
        {
          "$ref": "#/$defs/Union47_0_47"
        },
        {
          "$ref": "#/$defs/Union59_1_59"
        },
        {
          "$ref": "#/$defs/Union66_2_66"
        },
        {
          "$ref": "#/$defs/Union69_3_69"
        },
        {
          "$ref": "#/$defs/Union74_4_74"
        },
        {
          "$ref": "#/$defs/Union81_5_81"
        },
        {
          "$ref": "#/$defs/Union87_6_87"
        },
        {
          "$ref": "#/$defs/Union90_7_90"
        },
        {
          "$ref": "#/$defs/Union94_8_94"
        }
      ]
    },
    "Def_97": {
      "type": "object",
      "properties": {
        "path": {
          "type": "string"
        },
        "mode": {
          "type": "string",
          "enum": [
            "set",
            "merge"
          ]
        },
        "extensions": {
          "$ref": "#/$defs/extensions_7"
        }
      },
      "required": [
        "path"
      ],
      "additionalProperties": false
    },
    "workflow_101": {
      "type": "object",
      "properties": {
        "name": {
          "type": "string"
        },
        "version": {
          "type": "string"
        }
      },
      "required": [
        "name",
        "version"
      ],
      "additionalProperties": false
    },
    "source_100": {
      "type": "object",
      "properties": {
        "workflow": {
          "$ref": "#/$defs/workflow_101"
        },
        "node_id": {
          "type": "string"
        },
        "protocol": {
          "type": "string"
        },
        "action": {
          "type": "string"
        },
        "query": {
          "type": "string"
        },
        "step_id": {
          "type": "string"
        },
        "extensions": {
          "$ref": "#/$defs/extensions_7"
        }
      },
      "additionalProperties": false
    },
    "Def_10": {
      "type": "object",
      "properties": {
        "id": {
          "type": "string"
        },
        "chain": {
          "type": "string",
          "pattern": "^(eip155|solana|cosmos|bip122|aptos|sui):[a-zA-Z0-9._-]+$"
        },
        "kind": {
          "type": "string",
          "enum": [
            "action_ref",
            "query_ref",
            "execution"
          ]
        },
        "description": {
          "type": "string"
        },
        "deps": {
          "type": "array",
          "items": {
            "type": "string"
          }
        },
        "condition": {
          "$ref": "#/$defs/condition_17"
        },
        "assert": {
          "$ref": "#/$defs/condition_17"
        },
        "assert_message": {
          "type": "string"
        },
        "until": {
          "$ref": "#/$defs/condition_17"
        },
        "retry": {
          "$ref": "#/$defs/retry_39"
        },
        "timeout_ms": {
          "type": "integer",
          "exclusiveMinimum": 0
        },
        "bindings": {
          "$ref": "#/$defs/bindings_44"
        },
        "execution": {
          "$ref": "#/$defs/execution_46"
        },
        "writes": {
          "type": "array",
          "items": {
            "$ref": "#/$defs/Def_97"
          }
        },
        "source": {
          "$ref": "#/$defs/source_100"
        },
        "extensions": {
          "$ref": "#/$defs/extensions_7"
        }
      },
      "required": [
        "id",
        "chain",
        "kind",
        "execution"
      ],
      "additionalProperties": false
    },
    "Root_1": {
      "type": "object",
      "properties": {
        "schema": {
          "const": "ais-plan/0.0.3"
        },
        "meta": {
          "$ref": "#/$defs/meta_3"
        },
        "nodes": {
          "type": "array",
          "items": {
            "$ref": "#/$defs/Def_10"
          }
        },
        "extensions": {
          "$ref": "#/$defs/extensions_7"
        }
      },
      "required": [
        "schema",
        "nodes"
      ],
      "additionalProperties": false
    }
  }
}
