{
  "schema": "ais-plan/0.0.3",
  "meta": {},
  "nodes": [
    {
      "id": "q_wallet_native",
      "kind": "query_ref",
      "chain": "eip155:31338",
      "source": {
        "protocol": "evm-native-utils@0.0.1",
        "query": "native-balance"
      },
      "bindings": {
        "params": {
          "addr": {
            "lit": "0x70997970C51812dc3A010C7d01b50e0d17dc79C8"
          }
        }
      },
      "execution": {
        "type": "evm_rpc",
        "method": "eth_getBalance",
        "params": {
          "array": [
            {
              "ref": "params.addr"
            },
            {
              "lit": "latest"
            }
          ]
        }
      },
      "writes": [
        {
          "mode": "set",
          "path": "nodes.q_wallet_native.outputs"
        }
      ]
    },
    {
      "id": "q_wallet_erc20",
      "kind": "query_ref",
      "chain": "eip155:31338",
      "source": {
        "protocol": "erc20@0.0.2",
        "query": "balance-of"
      },
      "bindings": {
        "params": {
          "token": {
            "lit": {
              "chain_id": "eip155:31338",
              "symbol": "TST",
              "address": "0x8464135c8F25Da09e49BC8782676a84730C318bC",
              "decimals": 18
            }
          },
          "owner": {
            "lit": "0x70997970C51812dc3A010C7d01b50e0d17dc79C8"
          }
        }
      },
      "execution": {
        "type": "evm_read",
        "to": {
          "ref": "params.token.address"
        },
        "abi": {
          "type": "function",
          "name": "balanceOf",
          "inputs": [
            {
              "name": "owner",
              "type": "address"
            }
          ],
          "outputs": [
            {
              "name": "balance",
              "type": "uint256"
            }
          ]
        },
        "args": {
          "owner": {
            "ref": "params.owner"
          }
        }
      },
      "writes": [
        {
          "mode": "set",
          "path": "nodes.q_wallet_erc20.outputs"
        }
      ]
    },
    {
      "id": "a_transfer_native_5",
      "kind": "action_ref",
      "chain": "eip155:31338",
      "deps": [
        "q_wallet_native",
        "q_wallet_erc20"
      ],
      "condition": {
        "cel": "nodes.q_wallet_native.outputs.balance > to_atomic(\"100\", 18) && nodes.q_wallet_erc20.outputs.balance > to_atomic(\"100\", 18)"
      },
      "source": {
        "protocol": "evm-native-utils@0.0.1",
        "action": "native-transfer"
      },
      "bindings": {
        "params": {
          "to": {
            "lit": "0xf39Fd6e51aad88F6F4ce6aB8827279cffFb92266"
          },
          "amount": {
            "lit": "5"
          }
        }
      },
      "execution": {
        "type": "evm_call",
        "to": {
          "ref": "params.to"
        },
        "abi": {
          "type": "function",
          "name": "noop",
          "inputs": [],
          "outputs": []
        },
        "args": {},
        "value": {
          "cel": "to_atomic(params.amount, 18)"
        }
      },
      "extensions": {
        "risk_level": 3,
        "risk_tags": [
          "transfer"
        ]
      },
      "writes": [
        {
          "mode": "set",
          "path": "nodes.a_transfer_native_5.outputs"
        }
      ]
    },
    {
      "id": "a_transfer_erc20_10",
      "kind": "action_ref",
      "chain": "eip155:31338",
      "deps": [
        "a_transfer_native_5"
      ],
      "source": {
        "protocol": "erc20@0.0.2",
        "action": "transfer"
      },
      "bindings": {
        "params": {
          "token": {
            "lit": {
              "chain_id": "eip155:31338",
              "symbol": "TST",
              "address": "0x8464135c8F25Da09e49BC8782676a84730C318bC",
              "decimals": 18
            }
          },
          "to": {
            "lit": "0xf39Fd6e51aad88F6F4ce6aB8827279cffFb92266"
          },
          "amount": {
            "lit": "10000000000000000000"
          }
        }
      },
      "execution": {
        "type": "evm_call",
        "to": {
          "ref": "params.token.address"
        },
        "abi": {
          "type": "function",
          "name": "transfer",
          "inputs": [
            {
              "name": "to",
              "type": "address"
            },
            {
              "name": "amount",
              "type": "uint256"
            }
          ],
          "outputs": []
        },
        "args": {
          "to": {
            "ref": "params.to"
          },
          "amount": {
            "ref": "params.amount"
          }
        }
      },
      "extensions": {
        "risk_level": 3,
        "risk_tags": [
          "transfer"
        ]
      },
      "writes": [
        {
          "mode": "set",
          "path": "nodes.a_transfer_erc20_10.outputs"
        }
      ]
    }
  ],
  "extensions": {}
}
